"title","imgSrc","sellerName","rating","price","currency","listingId"
"Frank - Oil Painting - Danny DeVito - Art Print - It's Always Sunny In Philadelphia - Floral Painting - Ango Gobloggian - Funny Art - IASIP","https://i.etsystatic.com/6442746/d/il/6a865a/1443602430/il_340x270.1443602430_s53e.jpg?version=0","DrunkGirlDesigns","4.9307","13.00","$","584272746"
"Butts Print, Butts Wall Art, Prints for Bathroom, Funny Wall Art, Bathroom Art, Funny Art Print","https://i.etsystatic.com/10083103/c/1000/794/0/126/il/e7cf83/1466610428/il_340x270.1466610428_now5.jpg","AviatePress","4.9527","18.50","$","604393535"
"Otter Wall Art. Otter Art Print. Otter animal print. Unique gift for him. Cute otter art print. Otter gift. Funny art print. Otter print.","https://i.etsystatic.com/5589458/d/il/e8380a/1456251296/il_340x270.1456251296_pza2.jpg?version=0","GreymountPaperPress","4.9943","6.29","$","485510316"
"Who Run the World Music Poster, The Future is Female Print, Girlboss Gift for Her, Fun Pop Art Wall Art, Girl Power Gift, Feminism Art Print","https://i.etsystatic.com/7862442/c/1574/1250/52/238/il/bdf709/1265711687/il_340x270.1265711687_8k8i.jpg","DrawMeASong","4.9379","6.99","$","522552888"
"Travel Art Prints Train Station Airport Departures Board Customize Your Cities City Wall Decor Modern Art Large Art New York San Francisco","https://i.etsystatic.com/9570111/d/il/5c0781/1335361891/il_340x270.1335361891_fkys.jpg?version=0","MetropolisPrints","4.7","6.99","$","541984404"
"Picasso Art Print, Head Of A Women, Picasso Print, Drawing, Picasso Wall Art, Picasso Print, Picasso Printable, Picasso Digital Print","https://i.etsystatic.com/17627805/d/il/5dd4ae/1710187317/il_340x270.1710187317_la3m.jpg?version=0","InnerWildPrintables","5","12.50","$","611137131"
"Custom Map Printable Wall Art, Choose City Map, Any City Map, Custom Map Wall Art Print, Personalized Map, Map Gift Wall Art, Customized Map","https://i.etsystatic.com/18038730/c/1200/952/0/123/il/490154/1619718818/il_340x270.1619718818_kenz.jpg","NordicWalls","4.9706","12.00","$","629533423"
"Crossword, Funny bathroom art, bathroom print, Adult humor, Bathroom art, Typography, funny art, Home decor, Art, Prints, Bathroom humor","https://i.etsystatic.com/14638764/c/895/711/86/22/il/447d6e/1608042772/il_340x270.1608042772_91tz.jpg","ALFArtandCalligraphy","5","4.64","$","641031047"
"Work Hard and Be Nice to People, Quote Art Print, Wall Art, Typography, Office Art Print Decor, Inspirational, Motivational, Hustle","https://i.etsystatic.com/10517331/c/1098/871/0/69/il/40a8d1/1722573218/il_340x270.1722573218_e6ae.jpg","EllieAndNel","5","6.63","$","631338750"
"Set of 3 Indigo Art Prints 3 Piece Navy Blue Print Abstract Watercolor Print Minimalist Poster Modern Indigo Painting Navy Blue Wall Art","https://i.etsystatic.com/17762831/d/il/447492/1716963155/il_340x270.1716963155_hcn7.jpg?version=0","diamoderndesign","4.956","6.63","$","655381379"
"Art Print Set, Oyster Painting, Discounted Prints, Gallery Wall Art, Oyster Art, Coastal Art, Watercolor Print Set, Beach House Decor","https://i.etsystatic.com/8264828/d/il/37398a/1650738973/il_340x270.1650738973_trwg.jpg?version=0","ArtByAlexandraNicole","5","12.94","$","620399556"
"Anthony Bourdain Print, Large Fine Art Print of an Original Mixed Media Illustration - 10"" x 14""","https://i.etsystatic.com/11885947/c/1147/911/0/231/il/761680/1525720384/il_340x270.1525720384_ii5y.jpg","LewisRossignolArt","4.993","18.49","$","619942395"
"Mister Rogers - When I Say its You I Like: Art Print","https://i.etsystatic.com/14038764/d/il/4ba60c/1697260838/il_340x270.1697260838_g1sr.jpg?version=0","KimothyJoy","5","18.49","$","661463875"
"SLP Gift, Speech Language Pathologist, Speech Therapist, Speech Therapy, Slp Graduation Gift, SLP Office Decor, Slp Art Print, SLP Print","https://i.etsystatic.com/12128925/d/il/c01ffb/1749952967/il_340x270.1749952967_t2ur.jpg?version=0","ENORASIS","4.9599","20.00","$","602231860"
"Vintage Trout Print No. 1, Giclee, Fish Art, Fly Fishing, Cabin Decor, Angler Art, Fish Print, Art Print, Illustration, Collage, Trout Print","https://i.etsystatic.com/6823730/c/1500/1192/0/153/il/a2a2e9/1113557206/il_340x270.1113557206_e2md.jpg","BelleMaisonArt","4.9594","22.00","$","252370455"
"Get Naked Print, Quote Prints, Bedroom Decor, Typography Print, Art Print, Printable Quotes, Quotes, Downloadable Prints, Large Wall Art","https://i.etsystatic.com/12421481/d/il/557797/1569681699/il_340x270.1569681699_11rn.jpg?version=0","VividAtelier","4.9925","12.59","$","605200218"
"Custom Sheet Music Art Print, Custom Gift, Personalized Gift,Personalized Art, Wedding Gift, Anniversary Gift,Names and date, First Dance,","https://i.etsystatic.com/5435986/d/il/cd52c1/1461251547/il_340x270.1461251547_2wnh.jpg?version=0","WordsandMusicArt","4.9794","60.00","$","590550939"
"Federation Francaise de Pelote Basque (artist: Arrue) France 1924 - Vintage Advertisement (Art Print - Multiple Sizes Available)","https://i.etsystatic.com/7979419/d/il/f37918/1391588992/il_340x270.1391588992_spsr.jpg?version=0","LanternPressArtwork","4.9104","45.00","$","570146282"
"And Then My Soul Saw You - 11x14 Unframed Art Print - Great Wedding Gift/Gift To Significant Others","https://i.etsystatic.com/5396088/d/il/cd6e41/1739623610/il_340x270.1739623610_jhzb.jpg?version=0","LoneStarArtPrints","4.9211","22.00","$","650828286"
"Kitchen Wall Art Print Set, Eat Drink Love, Dandelions, Brown Seafoam Light Cream, Modern Kitchen Decor, Set of (6) Many Sizes // Unframed","https://i.etsystatic.com/6897384/d/il/4a22cc/1292211661/il_340x270.1292211661_2xqe.jpg?version=0","7WondersDesign","4.9328","5.95","$","530586666"